{
  "classifier_digest": "9b0fe4ea5db48512d7cfc891bca421bda97369465cad2506a0f020399bfa2abe",
  "content_digest": "0253d41c4f54155d340c4f5581121d9ed2146e65278054a6e49fb48ebb1f5997",
  "features": {
    "items": [
      {
        "archetype_id": "mono-blue-terror",
        "category": "new_technology",
        "deck": {
          "deck_fingerprint_sha256": "9da620d13e6f9e54a6ab1e76cafb78313b8536411c5c2796f8cef8abf5ed8823",
          "deck_id": "432084907928815e503c",
          "event_id": "12855463",
          "final_rank": 4,
          "main_deck": [
            {
              "name": "Abandon Attachments",
              "qty": 2
            },
            {
              "name": "Brainstorm",
              "qty": 4
            },
            {
              "name": "Counterspell",
              "qty": 4
            },
            {
              "name": "Cryptic Serpent",
              "qty": 4
            },
            {
              "name": "Dispel",
              "qty": 1
            },
            {
              "name": "Island",
              "qty": 16
            },
            {
              "name": "Lórien Revealed",
              "qty": 4
            },
            {
              "name": "Mental Note",
              "qty": 4
            },
            {
              "name": "Ponder",
              "qty": 2
            },
            {
              "name": "Sleep of the Dead",
              "qty": 2
            },
            {
              "name": "Sneaky Snacker",
              "qty": 4
            },
            {
              "name": "Spell Pierce",
              "qty": 2
            },
            {
              "name": "Thought Scour",
              "qty": 4
            },
            {
              "name": "Tolarian Terror",
              "qty": 4
            },
            {
              "name": "Twinned Vision",
              "qty": 3
            }
          ],
          "player": "Purgatory_01",
          "player_count": 51,
          "side_deck": [
            {
              "name": "Annul",
              "qty": 4
            },
            {
              "name": "Blue Elemental Blast",
              "qty": 2
            },
            {
              "name": "Gut Shot",
              "qty": 3
            },
            {
              "name": "Hydroblast",
              "qty": 4
            },
            {
              "name": "Murmuring Mystic",
              "qty": 1
            },
            {
              "name": "Steel Sabotage",
              "qty": 1
            }
          ],
          "starttime": "2026-10-01 19:00:00.0"
        },
        "destination_id": "deck:432084907928815e503c",
        "display_name": "Mono-Blue Terror",
        "featured_cards": [
          {
            "name": "Twinned Vision"
          },
          {
            "name": "Sneaky Snacker"
          },
          {
            "name": "Tolarian Terror"
          },
          {
            "name": "Mental Note"
          }
        ],
        "headline": {
          "en": "Mono-Blue Terror",
          "zh": "纯蓝惧兽"
        },
        "order": 1,
        "positioning": {
          "en": "A [[card:Sneaky Snacker|Sneaky Snacker]] version adding [[card:Twinned Vision|Twinned Vision]] as a discard outlet.",
          "zh": "加入[[card:Twinned Vision|双生视像]]作为弃牌源的贪吃灵版本"
        },
        "subtype_id": null,
        "supporting_facts": [
          {
            "type": "new_card",
            "values": {
              "cards": [
                "Twinned Vision"
              ],
              "set_code": "FRA"
            }
          }
        ]
      },
      {
        "archetype_id": "dimir-control",
        "category": "new_technology",
        "deck": {
          "deck_fingerprint_sha256": "c97e4d84d8336a9a5086d38e932cb8630f86f67b54c23c95acf053a39a56b5c6",
          "deck_id": "96d08dcd6ca15fe45a95",
          "event_id": "12855468",
          "final_rank": 2,
          "main_deck": [
            {
              "name": "Baleful Strix",
              "qty": 4
            },
            {
              "name": "Bojuka Bog",
              "qty": 1
            },
            {
              "name": "Campfire",
              "qty": 2
            },
            {
              "name": "Cast Down",
              "qty": 2
            },
            {
              "name": "Contaminated Aquifer",
              "qty": 4
            },
            {
              "name": "Counterspell",
              "qty": 4
            },
            {
              "name": "Cut Down",
              "qty": 2
            },
            {
              "name": "Dimir Aqueduct",
              "qty": 1
            },
            {
              "name": "Extract a Confession",
              "qty": 1
            },
            {
              "name": "Island",
              "qty": 9
            },
            {
              "name": "Lose Focus",
              "qty": 1
            },
            {
              "name": "Lórien Revealed",
              "qty": 4
            },
            {
              "name": "Murmuring Mystic",
              "qty": 3
            },
            {
              "name": "Plunder the Trollshaws",
              "qty": 4
            },
            {
              "name": "Preordain",
              "qty": 4
            },
            {
              "name": "Seething Landscape",
              "qty": 1
            },
            {
              "name": "Snuff Out",
              "qty": 4
            },
            {
              "name": "Spell Pierce",
              "qty": 3
            },
            {
              "name": "Suffocating Fumes",
              "qty": 1
            },
            {
              "name": "Swamp",
              "qty": 1
            },
            {
              "name": "Thorn of the Black Rose",
              "qty": 3
            },
            {
              "name": "Volatile Fjord",
              "qty": 1
            }
          ],
          "player": "Beicodegeia",
          "player_count": 49,
          "side_deck": [
            {
              "name": "Annul",
              "qty": 3
            },
            {
              "name": "Arms of Hadar",
              "qty": 1
            },
            {
              "name": "Drown in Sorrow",
              "qty": 1
            },
            {
              "name": "Hydroblast",
              "qty": 4
            },
            {
              "name": "Mountain",
              "qty": 1
            },
            {
              "name": "Nihil Spellbomb",
              "qty": 1
            },
            {
              "name": "Relic of Progenitus",
              "qty": 1
            },
            {
              "name": "Stream of Thought",
              "qty": 1
            },
            {
              "name": "Vandalblast",
              "qty": 2
            }
          ],
          "starttime": "2026-10-02 13:00:00.0"
        },
        "destination_id": "deck:96d08dcd6ca15fe45a95",
        "display_name": "Dimir Splash Red Control",
        "featured_cards": [
          {
            "name": "Baleful Strix"
          },
          {
            "name": "Counterspell"
          },
          {
            "name": "Plunder the Trollshaws"
          },
          {
            "name": "Thorn of the Black Rose"
          }
        ],
        "headline": {
          "en": "Dimir Splash Red Control",
          "zh": "蓝黑控制混红"
        },
        "order": 2,
        "positioning": {
          "en": "A Dimir Control build splashing red for [[card:Vandalblast|Vandalblast]] in the sideboard.",
          "zh": "备牌混红带[[card:Vandalblast|蛮野冲击]]的蓝黑控制构筑"
        },
        "subtype_id": "red-splash",
        "supporting_facts": [
          {
            "type": "new_archetype",
            "values": {
              "prior_record_count_under_current_classifier": 4
            }
          }
        ]
      }
    ]
  },
  "format": "pauper",
  "product": "mtgo-landing-features",
  "schema_version": "1.0.0",
  "source": "mtgo",
  "source_event_ids": [
    "12854944",
    "12854951",
    "12855452",
    "12855463",
    "12855468",
    "12855476",
    "12855493"
  ],
  "week": {
    "end": "2026-10-04",
    "id": "2026-W40",
    "start": "2026-09-28"
  }
}
